争论,主题
消除核武器将会消除由相互保证毁灭所造成的稳定。,我们应该为废除核武器而奋斗。
取消强制退休规定将对年长工人不利，使他们受到更严格的审查。,我们应该结束强制退休制度。
禁运可能会对实施国的经济产生负面影响。,我们应该结束使用经济制裁。
胚胎干细胞研究为许多重要的医学突破铺平了道路，有助于对抗致残疾病及由其引起的痛苦。,我们应该对胚胎干细胞研究进行补贴。
胚胎细胞研究可以帮助治愈疾病，因此任何有助于此的事物都应该得到资助。,我们应该资助胚胎干细胞研究
胚胎细胞研究涉及对年幼和未出生婴儿进行研究，侵犯了他们的同意权。,我们应该资助胚胎干细胞研究。
胚胎细胞已被证明在用于医学突破方面具有帮助，而其他细胞则没有同样的好处。,我们应该对胚胎干细胞研究进行补贴。
胚胎研究可以带来科学或医学方面的进展。,我们应该资助胚胎干细胞研究。
胚胎研究违背上帝的意愿，不应进一步推进。,我们应该资助胚胎干细胞研究
胚胎研究已被证明对于找到治疗癌症等许多疾病的方法非常有效。,我们应该资助胚胎干细胞研究
胚胎研究是一个具有争议的话题。,我们应该资助胚胎干细胞研究。
胚胎研究对于医学领域的进步、研究和可能的治疗方案至关重要。,我们应该资助胚胎干细胞研究。
胚胎干细胞研究具有巨大潜力，并需要得到应有的资金支持，以实现新的发现。,我们应该资助胚胎干细胞研究。
胚胎干细胞研究因争议过大而不适合通过补贴资助，而且会伤害那些反对使用胚胎细胞的人。,我们应该资助胚胎干细胞研究
胚胎干细胞研究可以引领医学发展的未来。,我们应该资助胚胎干细胞研究
胚胎干细胞很昂贵且没有前途。,我们应该资助胚胎干细胞研究
胚胎干细胞是癌症治疗的未来。,我们应该对胚胎干细胞研究提供资助。
胚胎干细胞研究可能导致肿瘤。,我们应该对胚胎干细胞研究进行补贴
胚胎干细胞研究可以为疾病带来新的治疗方法。,我们应该对胚胎干细胞研究进行补贴
大量人认为胚胎干细胞研究是不道德的。,我们应该对胚胎干细胞研究进行补贴
胚胎干细胞研究可以治愈像帕金森病这样的疾病。,我们应该对胚胎干细胞研究进行资助。
胚胎干细胞研究使科学能够发现治疗危及生命的疾病的疗法。,我们应该对胚胎干细胞研究提供补贴。
胚胎干细胞研究正在利用人类卵子在实验室培育。这些卵子本来可能已经发展为人类。我们正在尝试扮演上帝的角色，超越了人类的权利。,我们应该对胚胎干细胞研究进行资助。
胚胎干细胞研究对于更多了解困扰我们的各种疾病可以带来巨大的益处。为其提供补贴将加快研究进展，意味着更多人能够获益于健康。,我们应该对胚胎干细胞研究进行资助。
胚胎干细胞研究可以用于在实验室中培育器官，可以拯救许多生命。,我们应该对胚胎干细胞研究提供补贴。
胚胎干细胞研究可以在医学领域中创造重大、能挽救生命的进展。,我们应该对胚胎干细胞研究进行补贴。
胚胎干细胞研究可以为多种疾病找到治疗方法。,我们应该资助胚胎干细胞研究
胚胎干细胞研究可以帮助发现治疗危及生命疾病的新方法。,我们应该资助胚胎干细胞研究
胚胎干细胞研究可以帮助找到许多疾病的治疗方法。,我们应该对胚胎干细胞研究提供补贴
胚胎干细胞研究可以帮助治疗癌症、帕金森病和其他各种医疗问题。,我们应该对胚胎干细胞研究进行资助。
胚胎干细胞研究可以帮助医学界找到治愈许多致命疾病的方法。,我们应该对胚胎干细胞研究进行补贴。
胚胎干细胞研究如果我们给它一个机会，可以帮助我们治愈许多疾病。,我们应该资助胚胎干细胞研究。
胚胎干细胞研究可以带来挽救生命的突破，加速这一进程是我们的道德责任。,我们应该对胚胎干细胞研究进行资助。
胚胎干细胞研究耗费了大量资金，这些资金本可以更好地用于其他、更具道德的研究领域。,我们应该对胚胎干细胞研究进行资助
胚胎干细胞研究有望治愈癌症，因此需要尽可能多的支持。,我们应该对胚胎干细胞研究进行补贴。
胚胎干细胞研究可能会在寻找治愈方法方面定义我们的未来。,我们应该对胚胎干细胞研究进行补贴
胚胎干细胞研究可能为一些最致命疾病如癌症和白血病找到治疗方法。,我们应该给胚胎干细胞研究提供补贴。
胚胎干细胞研究可以帮助治愈许多疾病。,我们应该对胚胎干细胞研究进行补贴。
胚胎干细胞研究有助于发现能够治愈、预防和缓解医疗疾病的医疗治疗方法。,我们应该对胚胎干细胞研究进行补贴
胚胎干细胞研究有助于我们找到新的解决健康问题的方法。,我们应该资助胚胎干细胞研究
胚胎干细胞研究可能会为对抗多种疾病提供答案。,我们应该资助胚胎干细胞研究
胚胎干细胞研究有可能引发重大科学突破，挽救数百万人的生命。资助这项研究对许多人来说可能意味着生与死的区别。,我们应该对胚胎干细胞研究进行资助。
胚胎干细胞研究可能会导致发现新的医疗治疗方法，从而减轻许多人的痛苦。,我们应该对胚胎干细胞研究进行补贴。
胚胎干细胞研究有潜力拯救成千上万人的生命，需要尽可能多的支持。,我们应该资助胚胎干细胞研究
胚胎干细胞研究不应受到资助。杀害人类胚胎是不道德和不人道的，并不应该得到资金支持。,我们应该对胚胎干细胞研究进行补贴
胚胎干细胞研究的资助应该被禁止，因为这可能导致我们进行更危险的实验涉及人体。,我们应该资助胚胎干细胞研究。
胚胎干细胞研究违背了一切对生命有利的东西，不应该被使用。,我们应该补贴胚胎干细胞研究。
胚胎干细胞研究违背了各种宗教观点和信仰，不应受到资助。,我们应该对胚胎干细胞研究提供补贴
胚胎干细胞研究涉及到科学的灰色地带，本质上是在玩弄上帝的角色。这不是我们应该资助的事情。,我们应该资助胚胎干细胞研究
胚胎干细胞研究存在着巨大的滥用潜力,我们应该对胚胎干细胞研究进行补助。
胚胎干细胞研究存在很高的滥用潜力。,我们应该资助胚胎干细胞研究
胚胎干细胞研究已被证明可以治愈疾病，应当得到政府资助。,我们应该资助胚胎干细胞研究
胚胎干细胞研究给那些疾病无法治愈的人带来了很多希望。,我们应该补贴胚胞干细胞研究。
胚胎干细胞研究已经取得了医学上的突破性进展。,我们应该资助胚胎干细胞研究。
胚胎干细胞研究已经取得了医学上的突破，为许多罹患严重疾病的公民带来了希望。政府补贴将促进更多的研究，推动在许多领域取得突破。,我们应该资助胚胎干细胞研究
胚胎干细胞研究已挽救和改善了许多否则无法帮助的生命。通过进一步的财政支持，可以实现更多的成就。,我们应该对胚胎干细胞研究进行资助。
胚胎干细胞研究有潜力为许多疾病创造新的治疗方法。,我们应该对胚胎干细胞研究进行资助。
胚胎干细胞研究有潜力治愈无数患者。,我们应当对胚胎干细胞研究进行资助。
胚胎干细胞研究有潜力帮助治愈一些最具破坏性的疾病。,我们应该对胚胎干细胞研究进行补贴。
胚胎干细胞研究有潜力开启全新的健康医学领域。,我们应该对胚胎干细胞研究进行补贴。
胚胎干细胞研究具有彻底改变医疗保健的潜力。,我们应该资助胚胎干细胞研究
胚胎干细胞研究有潜力治疗，甚至治愈，影响成千上万人口的严重疾病。,我们应该对胚胎干细胞研究进行补贴。
胚胎干细胞研究有助于找到治疗疾病的方法。,我们应该对胚胎干细胞研究提供补贴。
胚胎干细胞研究有助于拯救和改善生命。,我们应该对胚胎干细胞研究进行补助。
胚胎干细胞研究有助于在癌症治疗方面提供创新，同时也有助于治疗帕金森病等患者，补助将为更多资金的资助提供可能。,我们应该对胚胎干细胞研究提供资助。
胚胎干细胞研究干涉了自然，不应该通过资助来鼓励。,我们应该补贴胚胎干细胞研究。
胚胎干细胞研究涉及破坏人类胚胎，这可能导致生命的诞生。,我们应该对胚胎干细胞研究进行补贴。
胚胎干细胞研究是医学研究的巨大进步,我们应该资助胚胎干细胞研究
胚胎干细胞研究违背上帝的意愿，应该停止。,我们应该资助胚胎干细胞研究
胚胎干细胞研究违背了许多宗教的信仰。,我们应该资助胚胎干细胞研究
胚胎干细胞研究违反了许多宗教信仰，纳税人不应被强迫支持这项研究。,我们应该资助胚胎干细胞研究
胚胎干细胞研究是一项不应该停止的先进医学进展。,我们应该对胚胎干细胞研究进行补贴。
胚胎干细胞研究是一个伦理道德的雷区，资金可能会更好地用在较少有争议的医学进步上。,我们应该资助胚胎干细胞研究
胚胎干细胞研究是科学研究的重要来源，它极大地增进了对人类状况以及许多严重的疾病和病症可以被治愈的理解。,我们应该资助胚胎干细胞研究.
胚胎干细胞研究是一种违背人类道德的不自然行为。其益处不足以证明这种行为的正当性。,我们应该对胚胎干细胞研究进行补助。
胚胎干细胞研究处于医学技术的前沿，有望帮助找到目前无法治愈的疾病的治疗方法。,我们应该对胚胎干细胞研究进行补贴。
胚胎干细胞研究是野蛮和不道德的,我们应该对胚胎干细胞研究提供资助。
胚胎干细胞研究备受争议，因此不应该获得政府资助。,我们应该补贴胚胎干细胞研究
胚胎干细胞研究是具有争议性的。一些人认为这是不道德的，因为它涉及从活体婴儿身上提取细胞。,我们应该对胚胎干细胞研究进行补贴。
胚胎干细胞研究目前是为那些患有脊髓损伤、帕金森病、渐冻症、多发性硬化等疾病提供有效治疗的最好希望。,我们应该为胚胎干细胞研究提供补贴。
胚胎干细胞研究本质上就是人类实验，如果一个人认为从受精那一刻起，受精卵就是一个人。,我们应该资助胚胎干细胞研究
胚胎干细胞研究在伦理和道德上是错误的，因为它需要摧毁潜在的人类生命。,我们应该对胚胎干细胞研究进行补贴。
胚胎干细胞研究在道德和伦理上是错误的。它侵犯了生命的神圣。,我们应该补贴胚胎干细胞研究
胚胎干细胞研究在伦理上是不可取的，并且其长期后果尚不明确。,我们应该资助胚胎干细胞研究。
胚胎干细胞研究费用昂贵，且对未来无明确结果。,我们应该资助胚胎干细胞研究
胚胎干细胞研究在医学领域非常有价值，可以帮助开发治疗方法和药物。,我们应该对胚胎干细胞研究进行补贴。
胚胎干细胞研究违背了自然和上帝。,我们应该对胚胎干细胞研究进行补贴。
胚胎干细胞研究正在帮助治疗疾病，拯救许多人。,我们应该资助胚胎干细胞研究。
胚胎干细胞研究备受争议，应该由私营部门来进行。,我们应该对胚胎干细胞研究进行补贴。
胚胎干细胞研究是违法、不道德和不必要的。,我们应该资助胚胎干细胞研究。
胚胎干细胞研究是不道德的，因为它会导致人类细胞的死亡。,我们应该对胚胎干细胞研究提供补贴。
胚胎干细胞研究是不道德的。,我们应该资助胚胎干细胞研究
胚胎干细胞研究对细胞研究的未来至关重要。,我们应该对胚胎干细胞研究进行补贴。
胚胎干细胞研究对于寻找治疗方法至关重要。,我们应该对胚胎干细胞研究进行补贴
胚胎干细胞研究对帮助治愈疾病和缺陷非常重要。,我们应该对胚胎干细胞研究进行补贴。
胚胎干细胞研究是很重要的。这项研究可以找到许多疾病的治愈方法，因此它应该得到资助。,我们应该对胚胎干细胞研究进行补贴。
胚胎干细胞研究很可能主要被富人使用，因此有理由让富人为此买单。,我们应该对胚胎干细胞研究进行补贴。
胚胎干细胞研究正在为治愈癌症取得进展。,我们应该对胚胎干细胞研究进行补贴。
胚胎干细胞研究在道德上是错误的，因为这意味着摧毁了一个人类生命。,我们应该对胚胎干细胞研究提供资助。
胚胎干细胞研究是谋杀。,我们应该对胚胎干细胞研究进行补贴。
胚胎干细胞研究是必要的，以了解如何预防死亡和疾病。,我们应该资助胚胎干细胞研究。
胚胎干细胞研究并非必要，因为实验室可以轻松地生产细胞用于研究，从而消除使用胚胎细胞的道德灰色地带。,我们应该资助胚胎干细胞研究
胚胎干细胞研究因为被认为不道德和不道德而受到不同宗教的反对。,我们应该资助胚胎干细胞研究
胚胎干细胞研究为各种治疗方法铺平了道路，应该不惜一切代价加以推动。,我们应该资助胚胎干细胞研究
胚胎干细胞研究被认为是在担任上帝的角色并冒犯了一些宗教。,我们应该给胚胎干细胞研究提供资助。
胚胎干细胞研究是当前处于前沿地带的研究，可能有一天能够为诸如癌症和阿尔茨海默病等疾病提供治愈方法。,我们应该对胚胎干细胞研究进行补贴。
胚胎干细胞研究是重要医学突破的基石，为许多致命疾病的治愈打开了大门。,我们应该对胚胎干细胞研究进行补贴。
胚胎干细胞研究是解决严重医学问题的最有效和最快的途径，比如移植、癌症、帕金森病等，否则这些问题将是无法治疗的。,我们应该对胚胎干细胞研究进行补贴。
胚胎干细胞研究是迄今为止治疗瘫痪、肌萎缩侧索硬化等疾病最具前景的途径。,我们应该对胚胎干细胞研究进行资助。
胚胎干细胞研究过于风险，可能导致人类灭亡。,我们应该资助胚胎干细胞研究
胚胎干细胞研究是不道德的，违背了人类的自然秩序。,我们应该对胚胎干细胞研究进行资助
胚胎干细胞研究是不道德和不道德的。,我们应该对胚胎干细胞研究进行补贴。
胚胎干细胞研究是不道德的，因为它利用了未出生婴儿的身体。,我们应该对胚胎干细胞研究进行补贴。
胚胎干细胞研究被许多人认为是不道德的。对于那些出于宗教或道德原因反对用他们的纳税收入资助这项研究的人来说，这是一种侵犯权利的行为。,我们应该对胚胎干细胞研究进行补贴。
胚胎干细胞研究是不道德的。,我们应该对胚胎干细胞研究进行补贴
胚胎干细胞研究在治疗疾病方面非常有用。,我们应该资助胚胎干细胞研究
胚胎干细胞研究对挽救生命非常重要。,我们应该对胚胎干细胞研究进行补贴。
胚胎干细胞研究对于找到治愈癌症和其他导致数百万人死亡的疾病的方法至关重要。,我们应该资助胚胎干细胞研究
胚胎干细胞研究对于新医学发现至关重要，因此应受到政府支持以推动科学进步。,我们应该对胚胎干细胞研究进行资助。
胚胎干细胞研究是错误的，因为它仅仅为了研究而摧毁胚胎。,我们应该资助胚胎干细胞研究
胚胎干细胞研究是错误的。,我们应该对胚胎干细胞研究提供补助。
胚胎干细胞研究导致胚胎死亡，应停止进行。,我们应该为胚胎干细胞研究提供补贴。
胚胎干细胞研究使医学科学中的重要突破成为可能，有助于减少痛苦。,我们应该资助胚胎干细胞研究
胚胎干细胞研究可能是治愈许多疾病的关键，应该受到鼓励和探索。,我们应该对胚胎干细胞研究进行资助。
胚胎干细胞研究可能有助于治疗许多严重的医学疾病的发展。,我们应该对胚胎干细胞研究提供资助。
胚胎干细胞研究可能在将来带来许多严重医疗疾病的治疗方法的发现。,我们应该资助胚胎干细胞研究
胚胎干细胞研究可能会导致生命挽救的治疗，比如培育备用器官，这可以拯救许多生命。,我们应该资助胚胎干细胞研究。
胚胎干细胞研究需要停止，因为这种研究不尊重人类生命。,我们应该资助胚胎干细胞研究。
胚胎干细胞研究应该限制在私人研究范围内。,我们应该对胚胎干细胞研究提供补贴。
胚胎干细胞研究在研究治疗方法和了解人类细胞方面发挥着重要作用。,我们应该对胚胎干细胞研究进行补贴。
胚胎干细胞研究为许多晚期疾病患者带来希望。,我们应该对胚胎干细胞研究提供资助。
胚胎干细胞研究需要破坏人类胚胎，因此被许多人认为是不道德的。,我们应该资助胚胎干细胞研究。
胚胎干细胞研究需要破坏人类胚胎，因此对许多人提出了道德关切。,我们应该对胚胎干细胞研究进行资助。
胚胎干细胞研究不应该用纳税人的金钱资助，因为宗教信仰的纳税人会对这项研究感到冒犯。,我们应该为胚胎干细胞研究提供补贴
胚胎干细胞研究应该由最需要的人承担费用，有限的政府研究预算应该保留给影响每个人的问题。,我们应该对胚胎干细胞研究进行补贴
胚胎干细胞研究应该被停止，因为它会在宗教人士中引起道德问题。,我们应该对胚胎干细胞研究提供资助。
胚胎干细胞研究应该停止，因为这些细胞来自无法表达对被用于研究目的的活生生的人类。,我们应该为胚胎干细胞研究提供补贴。
胚胎干细胞研究应该得到资助，因为这项研究可能为治疗医疗疾病提供重要突破。,我们应该资助胚胎干细胞研究
应该对胚胎干细胞研究进行补贴，因为这可能会导致人类发生巨大变化。这种研究可以逆转衰老，改变基因，并找到治愈疾病的方法。,我们应该资助胚胎干细胞研究
胚胎干细胞研究应该得到资助，因为它可能会导致治疗多种严重医疗状况的方法的开发。,我们应该对胚胎干细胞研究进行补贴
胚胎干细胞研究应该得到政府补贴，因为其快速的细胞复制速率意味着只需要少量细胞。,我们应该对胚胎干细胞研究提供资助。
胚胎干细胞研究应该得到资助，因为从中产生的治疗方法可能拯救无数生命。,我们应该为胚胎干细胞研究提供补贴。
胚胎干细胞研究应该得到资助，以加快识别治疗严重疾病的速度。,我们应该资助胚胎干细胞研究。
胚胎干细胞研究应该得到资助。这种研究将会找到治愈迄今无法治疗的疾病的方法。,我们应该资助胚胎干细胞研究
胚胎干细胞研究不应该得到资助，因为这需要摧毁人类胚胎，因此引发了严重的伦理问题。,我们应该对胚胎干细胞研究进行补贴。
胚胎干细胞研究不应该得到资助，因为对许多患者来说成本可能会非常昂贵。,我们应该对胚胎干细胞研究进行补贴。
胚胎干细胞研究不应该得到资助，因为还有更重要的事项需要解决。我们有成千上万的无家可归或饥饿的人。,我们应该资助胚胎干细胞研究
胚胎干细胞研究使用已受精的胚胎，因此有些人认为它们处于人类生命的初期阶段。因此，利用这些胚胎可能被解释为人类实验。,我们应该对胚胎干细胞研究进行补贴。
胚胎干细胞研究将使我们能在预防和治疗疾病方面取得重大突破。,我们应该资助胚胎干细胞研究。
胚胎干细胞研究将为许多疾病寻找到治愈方法。,我们应该资助胚胎干细胞研究
胚胎干细胞研究将有助于拯救生命，并且非常重要。,我们应该对胚胎干细胞研究进行补贴。
胚胎干细胞研究将增加为治疗致命疾病开发生命拯救疗法的机会。,我们应该资助胚胎干细胞研究。
胚胎干细胞研究将会带来医学突破。,我们应该资助胚胎干细胞研究
胚胎干细胞优于其他来源的干细胞，因为它们可以潜在地发展成任何类型的细胞——资助这项研究将促进科学研究更快地发展。,我们应当资助胚胎干细胞研究。
胚胎干细胞可以用来培育新器官，这有助于拯救数百万生命，治愈人们患有如心脏病和糖尿病等严重疾病。,我们应该资助胚胎干细胞研究。
胚胎干细胞有潜力挽救许多疾病，例如糖尿病。,我们应该对胚胎干细胞研究进行补贴。
已经证明胚胎干细胞具有拯救生命的能力。随着更多的研究，谁知道它们在减少疾病和改善生活质量方面还可以有多少用途。,我们应该资助胚胎干细胞研究
胚胎干细胞研究太接近仿照上帝的角色，因此不应得到支持。,我们应该资助胚胎干细胞研究。
胚胎干细胞研究应该被禁止，因为花在没有结果的研究上的资金，可以被重新投入到需要医疗护理的人群中。,我们应该资助胚胎干细胞研究
胚胎干细胞研究违背多种基督教的宗教信仰，不应当得到资助。,我们应该对胚胎干细胞研究进行补贴。
胚胎是受精卵——在我们能够解决生命始于何时的争论之前，利用胚胎进行科学研究是不道德的。,我们应该资助胚胎干细胞研究
胚胎是潜在的孩子，因此进一步进行研究是不道德的。,我们应该对胚胎干细胞研究进行资助。
胚胎干细胞研究可用来治愈目前尚无法解决的疾病、基因异常和畸形。,我们应该对胚胎干细胞研究进行补贴。
胚胎干细胞研究使用的是本来将被销毁的细胞。,我们应该对胚胎干细胞研究进行资助
被安置在寄养家庭中的儿童可能会发生情感和心理上的伤害，同时也可能出现由于被遗弃而引发的问题。,寄养比起好处更多地带来了伤害
情绪脆弱现象达到历史最高点，安全空间只是一个症状，而不是核心问题，因此禁止它们只会带来伤害。,我们应该废除安全空间。
根据实证的事实，加沙边境州遭受的轰炸在封锁之后减少了，解除封锁将会再次增加轰炸的频率。,加沙地带的封锁应该结束。
如果不限制高管的薪酬，低收入阶层的员工将对薪资差距拉大感到不满。,我们应该限制高管的薪酬
员工每周由于不断检查社交媒体而丧失了数小时的工作效率。,社交媒体带来的危害大于益处
雇主负担不起做这件事，新妈妈已经很难获得休假时间了。,我们应该补贴家庭主夫。
雇主应该可以在适当时结束一份雇佣关系。,我们应该废除强制性退休。
员工们通过职业教育获益过多，因为他们不必承担培训员工的责任和经济成本。,我们应该对职业教育进行补贴。
使人们能够随时随地学习并把所学技能运用到实践中。,我们应该对职业教育进行补贴
鼓励父亲在家庭生活中发挥更积极的作用，对社会来说只会是一件好事。,我们应该给选择留在家里照顾家庭的父亲提供补贴。
终止平权行动，奖励最合格的人，不论他们是谁。,我们应该终止平权行动。
取消肯定行动，因为它促进了逆向歧视。,我们应该终止平权法案。
解除封锁，停止对加沙地带最贫困群体造成的伤害,加沙地带的封锁应该结束。
无论出于何种原因，终结一个生命都是一种罪行。,协助自杀应该是一种刑事犯罪。
无论出于何种原因，结束生命都是违法的。,协助自杀应当被视为一种刑事犯罪。
终结平权政策违背了西方社会的道德和价值观。,我们应该终止平权行动。
终止平权政策将会在其核心动摇我们的基础。,我们应该终止平权法案
结束经济制裁是处理对我们构成问题或威胁西方社会的国家的唯一方法。唯有对话和交流应该是我们的选择。,我们应该停止使用经济制裁。
解除经济制裁将有助于让不同国家之间的贸易更加顺利。,我们应该结束使用经济制裁。
取消经济制裁将使所有国家能够自由与任何人进行贸易。,我们应当停止使用经济制裁。
取消强制退休制度对雇员不利,我们应该取消强制退休。
取消强制退休对帮助老年人是正确的事情。,我们应该取消强制退休。
取消强制退休制度传递了这样一种信息：所有年龄的工作者都拥有固有的价值。,我们应该废除强制退休。
"取消强制退休将使社会中最脆弱的群体—贫困群体—面临终身奴役的风险, 有效地重现了农奴制，而财富较丰裕的人仍将继续剥削他们。",我们应该结束强制退休。
取消强制退休制度将有助于减轻老年人口对国家养老金制度的负担。,我们应该废除强制退休。
