争论,主题
独身并不是人类的自然状态，强加给神职人员只会导致他们以不恰当的方式表达自己的性欲。,应该放弃禁欲的誓言
禁欲并不是人类自然的状态，因此不应该强加给任何人。然而，如果一个人自愿宣誓禁欲而没有被迫，那是可以接受的。,应该放弃贞洁誓言
独身并不是表达承诺的必要方式,应该放弃禁欲誓约
独身主义是古老且过时的，我们需要摆脱那些誓言。,独身誓约应该被废除
独身主义是天主教会掩盖儿童虐待问题的原因,独身誓言应当被放弃。
独身主要是人们希望实践的一种方式，以便能够将他们的生活奉献给他们的目标，无论是宗教、体育还是其他事物。,应该放弃独身誓言
独身主义是个人的选择，也是道德美德的展示，应该受到鼓励而不是 découragée 。,独身誓愿应该被放弃。
独身主义是唯一100%有效的避孕方式,应该放弃独身誓言
独身生活太难坚持了。人们有需要。,应当放弃独身誓言
独身是不自然的，对一个人的信仰没有任何有益的目的。,应该放弃禁欲的誓言
独身主义取决于每个人。,守独身誓言应当被放弃。
独身让人们能够专注于生活中重要的事情。,应该放弃独身誓言
独身会防止年轻人怀孕。,应当放弃独身誓言
独身有助于牧师们保持纪律和对上帝的爱，并应该得以保持。,应该放弃独身誓言。
独身制度给神职人员带来不必要的压力，导致他们隐藏自己的同性恋倾向和恋童癖，应当停止。,禁欲的誓约应该被放弃。
独身应该是个人选择，而不是法律决定的事情。,独身誓约应该被放弃。
"""独身主义不应该被放弃，因为这是个人信仰的表达，并且他们有权利表达这一观点。""",独身誓约应该被废除
独身主义不应被抛弃，因为对于保持道德、避免意外怀孕和性传播疾病是很重要的。,独身誓言应该被放弃
独身并不应该被抛弃，在合适的情况下可以成为一种赋予力量的状态。,独身誓言应该被废除。
独身誓约是一个人应被允许做出的选择。,誓言独身应该被放弃
禁欲誓言是不自然的，可能会引发问题。,守独身誓言应该被放弃。
独身誓言抑制了自然的冲动，这些冲动可能会以有害的方式表现出来。,应该放弃独身誓言。
禁欲者不会患性传播感染或疾病，因此更健康，所以不应被抛弃。,应该放弃独身誓言
CEO的薪酬已经失控，过高了。,我们应限制高管的薪酬
CEO的薪酬是普通工人的100倍，但他们实际上并不创造任何资本。,我们应该限制高管的薪酬
CEO不应该比他们的工人多赚数千倍的薪水。,我们应该限制高管薪酬
某些领域需要规章制度。没有规定，强者会占弱者的便宜。,我们应该采用古典自由主义。
某些文化已经猎杀鲸鱼数千年。,我们应该禁止捕鲸。
某些群体比其他群体更容易犯罪。,我们应该终止种族歧视审查。
一些特定群体需要枪支，比如农民在农村社区需要应对可能威胁作物和牲畜的野生动物。,我们应该废除持有和携带武器的权利
某些群体不应该因为他们的祖先遭受歧视，就被给予特殊待遇，比如黑人，没有人对当前一代欠任何东西,我们应该终止平权措施。
一些物品和武器等在学校里是不适当的，只会制造问题。,我们应该在学校实施零容忍政策
某些司法错误只有通过进行司法激进主义的法官才能得到纠正。,我们应该限制司法激进主义。
世界上某些地方没有法律约束，唯一阻止这种情况下的危险个体的方法是有针对性地实施暗杀。,我们应该禁止有针对性的暗杀。
某些职业，比如警察和空中交通管制员，设有强制退休年龄，以确保负责他人安全的人保持胜任以继续工作。,我们应该废除强制退休。
某些种族和族裔比其他人犯罪的概率更高，因此更加密切地审查他们是有道理的。,我们应该结束种族歧视定型。
某些宗教只使用这种类型的护理，这是他们的权利。,我们应该禁止自然疗法。
某些物种的繁殖数量失控，需要减少其数量。,我们应该禁止有针对性的暗杀。
某些类型的分析是必要的。如果你正在寻找一个银行抢劫犯，那么确实不需要检查街上行走的95岁老太太。,我们应该结束种族歧视。
变化和进步是不可避免的，我们应该接受它。,我们应该停止自动驾驶汽车的发展
交易进行时可能会发生变化，但可能无法对其进行调整。,我们应该禁止算法交易
如果一个人否认大屠杀，却因此被控以刑事罪名，这违背了宪法赋予的言论自由权利，因此不应该得到支持。,否认大屠杀应该成为一种刑事犯罪。
富裕学生在参加大学标准化考试时普遍存在作弊行为。,智力测试带来的伤害大于好处。
在民主制度中，平衡政府权力的使用是使民主成为更好的统治形式的关键。司法活动将限制政府对权力的过度使用。,我们应限制司法激进主义。
契诃夫的“契诃夫之枪”定会在第三幕中被开火；核武器也必定会在核战中被使用。,我们应该为废除核武器而奋斗。
切尔西足球俱乐部真的需要克隆德罗巴，这样我们就可以有一个能进球的前锋。,我们应该禁止人类克隆。
儿童演员选择做他们的工作是因为他们热爱表演。,我们应该禁止使用童星演员。
寄养家庭中儿童虐待的比例更大。,寄养护理带来更多的伤害而非好处
儿童表演为年轻人带来收入。如果你天生具有娱乐天赋，为什么不抓住机会呢？,我们应该禁止使用童星。
儿童表演是一种剥夺他们青春的童工行为，导致了情感创伤，使他们沉溺于酗酒、吸毒等行为，甚至更糟的后果。,我们应该禁止使用儿童演员。
儿童表演导致许多儿童接触到成人场景，从而导致更早的性行为和药物使用。他们不像正常的孩子那样行事，通常导致抑郁。,我们应该禁止使用童星。
在很小的年龄就取得名气的童星通常会经历巨大的发展问题，并无法适应成年人的生活 - 聚光灯下对他们的成长并不健康。,我们应该禁止使用童星。
在片场，儿童演员有机会完成学校作业，并得到受保护的成长环境。由于没有造成伤害，因此无需禁止在电视和电影中使用儿童。,我们应该禁止使用童星。
儿童演员往往会被创伤或虐待，所以应该禁止他们的使用。,我们应该禁止使用儿童演员。
儿童演员是表演行业的重要组成部分，应该继续允许他们参与演出，但应该有限制以确保儿童的健康和福祉。,我们应该禁止使用童星演员。
童星是电影/电视行业的重要组成部分，如果没有他们，就会一团糟。,我们应该禁止使用儿童演员。
年轻演员容易受到精神和性虐待的风险，这将破坏他们在生活中的成长。,我们应该禁止使用儿童演员。
儿童演员受到现行法律的严格监管和保护，不应该被禁止。,我们应该禁止使用童星。
儿童演员既受到父母又受到视频行业的剥削，儿童应该在不工作的情况下学习和成长。,我们应该禁止使用儿童演员。
儿童演员受到成年人的剥削，应该被禁止。,我们应该禁止使用童星。
童星们暴露于过多的成人情境，承受着许多有害行为，在演艺界受到了影响，因此应禁止童星。,我们应该禁止使用童星演员。
儿童演员暴露在过多的成人世界中，更容易接触毒品和酒精。许多前儿童演员最终成瘾就是因为这个原因。,我们应该禁止使用童星。
只要负责的成年人在看护，就可以使用童星。,我们应该禁止使用童星演员。
大部分情况下，童星是被迫扮演他们不想要的角色，而他们的父母则收取收益。,我们应该禁止使用儿童演员。
童星被迫过早长大，表现得像成年人一样。我们需要给他们机会做孩子。,我们应该禁止使用儿童演员。
童星被迫过早成熟，他们在很小的时候就被投入到一个充斥着毒品和性的世界中。孩子们应该远离这一切，直到好莱坞对他们来说是安全的。,我们应该禁止使用儿童演员。
童星被迫长时间工作，通常被免除常规学校教育，可能对他们的健康发展造成伤害。,我们应该禁止使用童星演员。
儿童演员在这个领域中很重要。,我们应该禁止使用儿童演员。
儿童演员是重要的，因为节目需要展示各个年龄段的人，反映社会的真实状态。儿童演员是影视行业的重要组成部分，需要准确地反映人们的形象。,我们应该禁止使用儿童演员
童星生活在一个成人世界里，看到了他们太过幼稚难以理解的事物。,我们应该禁止使用童星演员。
儿童演员是必不可少的，孩子甚至可以在很小的年纪学会如何工作。,我们应该禁止使用童星演员。
在电影和电视中，需要有儿童演员来扮演年轻人的角色。,我们应该禁止使用童星演员。
电视和电影行业需要许多角色的儿童演员。,我们应该禁止使用童星。
需要儿童演员扮演一些成年演员难以胜任的角色，因此禁止他们的使用将是不可能的。,我们应该禁止使用儿童演员。
需要在各种类型的电影中都需要儿童演员，因此不应该禁止他们。,我们应该禁止使用儿童演员。
需要儿童演员来扮演特定角色,我们应该禁止使用儿童演员。
需要儿童演员来扮演孩子的角色,我们应该禁止使用儿童演员。
需要儿童演员来扮演儿童角色。,我们应该禁止使用童星。
需要儿童演员来扮演电影和电视节目中的儿童角色，我们不能禁止他们。,我们应该禁止使用童星。
幼童演员无法独立做出决定，被置身于他们不理解的环境中，仅为他人的经济利益而存在，因此应该被禁止。,我们应该禁止使用童星。
年幼的演员还不够成熟来应对演艺圈的压力。,我们应该禁止使用儿童演员。
儿童演员因常常受到行业的引诱和虐待而臭名昭著。我们必须确保他们的安全。,我们应该禁止使用童星演员。
儿童演员经常受到电影行业的剥削，不应该被利用。,我们应该禁止使用童星。
童星经常受到电影界或他们自己的父母的剥削。,我们应该禁止使用儿童演员。
儿童演员经常被父母剥削以谋取金钱。,我们应该禁止使用童星。
因为合同义务的原因，很多儿童演员常常被迫继续演戏，即使他们已经失去了这样做的愿望。,我们应该禁止使用未成年人演员。
小演员经常被迫过早成熟，这种方式会永久地阻碍他们的发展。,我们应该禁止使用童星。
儿童演员常常被迫过早成熟，失去了传统意义上的童年。,我们应该禁止使用童星。
年轻演员通常只是由剥削性父母控制的傀儡，年幼时被迫步入聚光灯下往往会导致日后的不适应和情感问题。,我们应该禁止使用童星。
儿童演员通常无法获得他们的收入，因为资金由他们的家人控制。,我们应该禁止使用童星演员。
年幼的演员常常容易受到急于成功的父母和行业主导者的剥削，后者最关心的是金钱，而不是未成年人的福祉。,我们应该禁止使用童星。
儿童演员常常是被他们的家长逼迫参与演艺活动，而家长会拿走他们的钱。,我们应该禁止使用童星。
很多人利用小演员赚钱，但当他们变得太老无法再接受以前的工作时，却常常无人照顾，任其自生自灭。,我们应该禁止使用童星。
通常情况下，童星得到很好的照顾和监督，几乎没有受到伤害的机会。,我们应该禁止使用童星。
童星们被置身于一种他们还太年幼应该不该置身其中的环境。,我们应该禁止使用童星。
未成年演员受到严格的健康和安全法规保护，他们仍然必须接受教育，并且他们赚取的钱意味着他们将能够在成年后做想做的事情。,我们应该禁止使用童星。
儿童演员被置于容易遭受捕食者侵害的情况下，错过了接受教育的机会，也无法在日常生活中建立社交联系。,我们应该禁止使用童星。
年幼的表演者经历了太多的事情。我们应该废除他们，只使用CGI或类似的技术。如果一个大公司可以将CGI电影称为真人影片并且得逞，这种做法将行得通。,我们应该禁止使用童星演员。
童星们真的是在从事劳动，而童工是违法的。,我们应该禁止使用童星演员。
童星被剥夺了他们的童年，成年后可能面临许多情感困扰，因为他们错过了童年这一重要阶段。,我们应该禁止使用童星。
童星被剥夺了他们的童年。,我们应该禁止使用童星。
童星是孩子们的榜样，并且对他们的良好选择产生的影响可能比仅有成人演员出演的电影要大。,我们应该禁止使用童星演员。
从小就设定好生活的童星应该受到鼓励，而不是被禁止出演,我们应该禁止使用童星。
有时候，童星是被他们的父母强迫从事这项工作的，他们错过了拥有正常童年的机会。这可能导致他们成年后出现功能障碍。,我们应该禁止使用童星。
有时候小演员被过度劳累并置身危险境地，因此应该被禁止。,我们应该禁止使用童星。
童星承受了太多的压力，无法像普通孩子一样与朋友玩耍、上学生活。这种压力通常会导致他们在未来生活中出现健康问题。,我们应该禁止使用童星。
儿童演员经常受到监督，他们还有导师来帮助他们跟上学业。,我们应该禁止使用童星。
儿童演员经常受到监督，得到很好的照顾，而且有现场辅导老师，以便他们不落后于学业。,我们应该禁止使用童星演员。
儿童演员被不断监督，得到很好的照顾，并在片场有导师，确保他们不会在学业上落后。,我们应该禁止使用童星演员。
孩子演员经常在某种程度上被剥削和虐待，导致许多问题成年人或早逝，因此，我们应该努力消除他们的使用。,我们应该禁止使用童星。
儿童演员被当作成年人对待，错过了孩子们需要成为健康成年人的社会和情感成熟过程。,我们应该禁止使用童星。
在这个行业中，童星受到很差的对待。,我们应该禁止使用童星演员。
儿童演员很有用，因为这让这些孩子可以通过做自己喜欢的事情谋生。,我们应该禁止使用童星演员。
通常情况下，小演员会被他们的父母和其他成年人利用。他们应该被允许做孩子。,我们应该禁止使用儿童演员。
通常情况下，童星是过分强势的父母或舞台妈妈的产物，而不是他们自己的意愿。,我们应该禁止使用童星。
儿童演员对娱乐产业至关重要。,我们应该禁止使用童星。
儿童演员容易受到许多公众以及演艺行业内的捕食者的伤害，他们的参与应该受到禁止。,我们应该禁止使用童星演员。
童星们得到了丰厚的报酬，他们为轻松的工作而工作，这为他们在所选择领域中更高的目标提供了所需的资金。,我们应该禁止使用童星。
儿童演员工作时间太长，这可能会对他们的身体、情感和学业造成伤害。,我们应该禁止使用童星演员。
童星成年得太快，不应该被允许在成年前拍戏。,我们应该禁止使用童星演员。
童星给世界带来了很多快乐，我们应该允许他们继续发展，并在需要时提供更好的指导。,我们应该禁止使用童星。
小演员可能会被过度工作，从而错过他们的教育。,我们应该禁止使用童星。
儿童演员可能会被过度工作，导致他们无法继续接受教育。如果他们没有完成学业，将会在以后的生活中面临困难。,我们应该禁止使用童星演员。
童星很容易受到剥削和虐待。,我们应该禁止使用童星。
童星可以学习到宝贵的社交技巧，这些技巧将来可能对他们有益。,我们应该禁止使用童星。
年轻演员可以通过做自己喜欢的事情赚取一大笔钱，为自己的未来做准备。,我们应该禁止使用童星。
许多儿童演员在成长过程中通常并没有问题，反而因为获得了财富，能够在生活中得到帮助。仅仅因为少数“坏苹果”而决定所有人的命运是错误的。,我们应该禁止使用童星。
儿童演员可以通过所赚取的收入为将来上大学做准备，并可以由家人和经纪人保护他们在年幼的演艺生涯中的安全。,我们应该禁止使用儿童演员。
儿童演员无法被禁止，因为一个典型的家庭在电影或电视中将无法呈现。,我们应该禁止使用童星演员。
儿童演员选择做他们所做的事情。,我们应该禁止使用儿童演员。
儿童演员不容易被成年演员或CGI替代，而得以参与演戏的孩子们将学习宝贵的人生经历，接受良好的教育和情感支持，同时也能够赚取可观的报酬。,我们应该禁止使用儿童演员。
儿童演员为年轻人创造了就业机会。为什么我们要剥夺任何人的工作机会呢？,我们应该禁止使用童星演员。
儿童演员没有得到适当的教育，因此应禁止使用儿童演员。,我们应该禁止使用童星。
童星们没有机会拥有真正的童年。,我们应该禁止使用童星演员。
儿童演员无法过上正常的少年生活，体验童年的玩乐、教育和社交互动，因此应该被禁止。,我们应该禁止使用儿童演员。
由于工作性质要求他们经常在不同地方工作，儿童演员无法像普通孩子那样过正常的成长生活，他们的教育也会受到影响，对他们的健康有害。,我们应该禁止使用童星演员。
年幼的演员们并不会错过上学，因为他们通常在片场有家教陪读。,我们应该禁止使用童星演员。
在好莱坞，儿童演员经常受到剥削，这项禁令将会制止这种情况。,我们应该禁止使用童星演员。
童星可以体验大多数孩子所未曾体验过的生活方式，如果工作能够平衡正常童年经历，那可能会很有趣。,我们应该禁止使用童星演员。
孩子演员习惯了爱和关注，然后失去了它。,我们应该禁止使用童星。
儿童演员长大后成为功能失调的成年人，因为他们缺少与其他孩子之间所需的社交互动，从而无法学习如何与同龄人交往的过程。,我们应该禁止使用童星演员。
童星长大后常常面临药物、酒精和自尊问题的困扰。,我们应该禁止使用童星。
童星比其他孩子有更广泛的经历，这会让他们在成年后拥有更多自信和财富，有助于提升他们的成年生活。,我们应该禁止使用童星。
为什么要禁止孩子演员获得学校教育和社会经验以及未来职业发展的宝贵机会呢？,我们应该禁止使用童星。
童星失去了正常童年的感觉。,我们应该禁止使用童星。
年幼的演员在工作时失去了他们的童年，他们在一个有压力、有毒的环境中长大，而不是一个充满爱的家庭。,我们应该禁止使用童星演员。
儿童演员错过了像正常孩子一样自然成长的机会，他们应该接受适当的教育，拥有稳定的家庭背景，没有早期工作的压力，因此应该被禁止。,我们应该禁止使用童星。
儿童演员错过了与同龄孩子的社交活动，从而在学业上落后。,我们应该禁止使用童星。
童星错过了他们的童年，比如交朋友、玩运动和上学。,我们应该禁止使用童星演员。
儿童演员需要从事表演工作，因为许多电影和电视节目中都有儿童角色。,我们应该禁止使用童星。
儿童演员从未有过真正的童年，应该被禁止演出。,我们应该禁止使用童星演员
孩子演员通常是家庭的主要经济支柱。,我们应该禁止使用童星。
年幼时的演员经常成为不适应社会的成年人，并经常陷入药物滥用。,我们应该禁止使用童星。
许多童星往往无法适应突加在他们身上的名望，因此成人应该扮演儿童角色。,我们应该禁止使用童星。
儿童演员很少能在成年后成长为全面发展的成年人，因为作为儿童演员所面临的压力与普通儿童的成长环境存在较大差异。,我们应该禁止使用童星。
儿童演员应该能够最大化他们的潜力并赚取像任何其他群体一样的钱 - 禁止他们是年龄歧视，而且他们的职业窗口通常非常狭窄。,我们应该禁止使用童星。
应该允许儿童演员工作，为社会贡献他们的才华。,我们应该禁止使用童星演员。
应禁止儿童演员，因为他们没有机会过正常生活,我们应该禁止使用儿童演员。
应禁止儿童演员，因为他们无法在稳定的家庭环境中健康成长，也无法获得充分的教育。,我们应该禁止使用童星。
应该禁止儿童演员，因为儿童经常被剥削他们的角色，他们得到的钱多到不知道如何使用，并经常在毒品和其他恶习上挥霍。,我们应该禁止使用童星。
应该禁止儿童演员，因为强迫孩子在如此年幼的时候工作是不公平的。,我们应该禁止使用童星。
不应禁止儿童演员，因为谁会来扮演电影中的孩子呢？这是无法避免的，因为儿童是生活的一部分，因此也是许多故事的一部分。,我们应该禁止使用童星演员。
不应该因为个别不良现象就禁止儿童演员。在良好的指导下，这些演员可以继续支付自己的大学费用，并成为负责任的公民。,我们应该禁止使用童星。
不应该使用童星，因为他们会接触成人世界，可能会导致腐化和上瘾。,我们应该禁止使用童星。
儿童演员往往成长为心理受困扰的成年人。这对他们是不公平的，因此我们应该禁止使用儿童演员。,我们应该禁止使用童星。
在适当的监督和规范下，童星们会做得很好。,我们应该禁止使用儿童演员。
儿童劳动法已经限制了儿童能够从事的工作数量。,我们应该禁止使用儿童演员。
童年是学习和成长的时光，而不是工作。,我们应该禁止使用童星。
童年是个人发展的重要阶段。在如此年幼的年纪就成为演员的压力和名声，已经多次被证明会导致成年后出现问题的情况。,我们应该禁止使用儿童演员。
当孩子的父母结婚时，孩子在生活中会取得更好的成果。,我们应该放弃婚姻
儿童演员是经过训练，可以生活和扮演作品的人，以便表现不同的情景。,我们应该禁止使用童星演员。
孩子也有权修改自己的外表,我们应该禁止未成年人进行整容手术。
孩子和成年人都花费太多时间看电视，而不是做一些像阅读、锻炼、交谈等的事情。,我们应该放弃电视
孩子们是社会的一部分，并不是所有的故事或电影中都只有成年人。,我们应该禁止使用儿童演员。
孩子们是娱乐行业不可或缺的一部分，他们承担了其他人不愿意或无法承担的角色。,我们应该禁止使用童星演员。
儿童在寄养家庭比在街上或少管所过得更好。,寄养护理带来的伤害大于益处
孩子就是孩子，他们会从错误中学习。他们不总是第一次就做对，我们必须允许他们犯错误不止一次。,我们应该在学校实施零容忍政策
孩子们被他们的父母和内容创作者为了赚钱而剥削。,我们应该禁止使用童星。
孩子们太容易受到剥削，有时会因为名利而过早地变得过分聪明。,我们应该禁止使用儿童演员。
儿童也是人类，他们应该在获得他们自己和父母同意的情况下被允许工作。,我们应该禁止使用童星。
孩子们实质上无法做出明智的决定，因为他们的前额叶皮质发育不够成熟，无法充分考虑和内化进行整形手术所伴随的危险。,我们应该禁止未成年人进行整形手术。
孩子们对权威的尊重正在以惊人的速度丧失，这是我们唯一能阻止这种下降趋势的方式,我们应该在学校实行零容忍政策
孩子们在一个家庭环境中会得到更好的照顾，能够被爱并获得个性化关注，而不是被留给自我照顾在一个机构里。,寄养制度带来的害处多于好处
儿童天真无邪，通常容易被操纵或者没有得到公平的补偿。,我们应该禁止使用儿童演员。
儿童无法同意或理解由整容手术产生的永久变化。,我们应该禁止未成年人进行整形手术。
儿童无法建立联系，往往会在寄养照顾中受到虐待。,寄养制度带来的危害远大于好处。
孩子们并不适合电影片场上严苛且有时不恰当的环境。,我们应该禁止使用童星。
孩子们尚未完全发育，容易做出错误的判断。,我们应该在学校实施零容忍政策
孩子们还不足以应对演艺的压力。,我们应该禁止使用童星演员。
孩子们还不足够成熟，不能做出知情决定。,我们应该禁止未成年人进行整形手术
