争论,主题
“婚姻”与时俱进。放弃旧思维，引入一种能包容所有联合关系的新形式 - 不仅仅是男女之间的关系。,我们应该放弃婚姻
一个多党制系统会太过混乱，而从广大公众中获得共识也会很困难。,我们应该采取多党制。
学校不应采用零容忍政策，因为情况往往不是非黑即白，而更为微妙。任何人都不应因判断错误而被彻底抛弃。,我们应该在学校实施零容忍的政策。
当涉及到他们的生活质量时，人们达到了极限，并且应该有权结束他们的痛苦。 这可以通过协助而很少或没有痛苦地完成，并且个人有能力说再见。,协助自杀应被视为犯罪。
完全同意，如果他们这样做的话，那将是件好事。,我们应该废除安全空间
600万人丧生，因此否认大屠杀应该被视为对他们记忆的一种罪行,否认大屠杀应该是一种犯罪行为
智力测试得分低对我们的孩子的动力和自尊心是一个打击，会降低动力并造成伤害。,智力测试带来的危害大于益处
智力测试得分低对人的自尊是一个打击，不仅会伤害他们的感受，也会影响社会的发展。,智力测试带来的伤害胜过好处。
禁止自然疗法创建了科学家和政府之间的团结阵线，可以共同打击自然疗法行业中反科学的说辞。,我们应该禁止自然疗法
对代孕母亲来说，禁止代孕将是灾难性的。代孕无论如何都会发生，因为存在这样的需求，但对于这一过程将没有健康和法律标准。,代孕应该被禁止
禁令是无效的，那些极其渴望拥有孩子的人，会想方设法去完成。要么非法地，要么在一些没有禁止的偏远国家。,代孕应该被禁止
禁令只会给性别平等带来问题,我们应该禁止妇女参与战斗
禁令只会加剧已经存在的趋势，即前往危险的海外外科医生处就诊。,我们应该禁止整形手术
禁令会传递一个强烈的信息，即需要改善商业实践。,发薪日贷款应该被禁止。
惩罚的一个基本原则是应当与犯罪成正比，因此，对于像故意杀人这样的罪行，死刑是唯一合法的回应。,我们应该废除死刑
出生缺陷或毁容伤害可能会极大地影响一个人的自尊心，在获得父母许可的情况下，未成年人应该有机会进行矫正。,我们应该禁止未成年人进行整形手术
封锁有时是在试图迫使外交手段发挥作用时唯一的非暴力选择。,加沙地带的封锁应该结束。
封锁是在双方都制造停滞的完美方式,加沙地带的封锁应该被结束
封锁是当你希望消除和平的任何机会，并使两国对彼此产生怀疑时所采取的行动。,加沙地带的封锁应该被解除
《神经元》杂志在线发表的一项加拿大研究得出结论，认为智商测试存在根本缺陷，因为其问题严重简化了人类大脑的能力。,智力测试带来更多的伤害而不是好处
一个集中式的刑事辩护系统意味着所有人都能获得同样标准的法律辩护，这意味着财富和权力不能被用来逃避正义。,公共辩护律师的使用应该是强制性的
一个孩子不能随便走进整形外科医生的诊所接受不必要的手术，家长同意和医疗规定旨在确保这些手术只在安全且有必要的情况下进行。,我们应该禁止未成年人进行整形手术
孩子是一份礼物，无论是哪种性别都应该倍加珍惜。,我们应该合法化性别选择
一个孩子在身体和心智上都还在成长，整形手术不应被考虑，直到他们成年并能够做出这些决定。,我们应该禁止未成年人进行整形手术
一个人类克隆所产生的孩子会有心理问题，因为他们无法做自己。,我们应禁止人类克隆
一个孩子的身体还在发育，孩子所看到的自身缺陷在长大成人后可能会得到解决。,我们应该禁止未成年人做整形手术
一个孩子的价值不应该根据他们的性别来评判。无论如何，他们都是人类。,我们应该将性别选择合法化
城市是人们得以靠近他们所需之物的最佳地方。,我们应该抵抗城市化。
一个集体主义文化培养了一些良好的价值观，比如善良、慷慨、关心他人的需求。,我们应该反对集体主义。
大学学位不再是确保你能找到工作的保证，甚至在现在的社会中也不再是讨好职业的必要条件。大多数学位正在变得过时，这是浪费钱。,我们应该对学生贷款进行补贴。
大部分人无法负担得起大学教育的费用。然而，几乎是要得到一份好工作的必备条件。通过帮助支付学生贷款，我们也在帮助我们的经济，提供更好的就业机会。,我们应该对学生贷款进行补贴
一家公司可以支付高管任何它想支付的薪水。如果这个人对公司有很大的价值，他的薪水无论有多高都是值得的。,我们应该限制高管的薪酬
如果执行薪酬受限，公司可以支付更高的工资给他们的员工。,我们应该限制高管的报酬
一家公司有权决定支付高管薪酬的金额。,我们应该限制高管的薪酬
一家公司应该能够自行决定向任何员工支付多少薪水,我们应该限制高管薪酬
一家公司应该有能力支付他们需要的任何费用来吸引合适的人才。他们只会支付市场所确定的一个人值得的价格。,我们应该限制高管薪酬
强制投票让每个人都贡献自己的意见。,我们应该引入强制投票。
不断增长的人口需要每年以恒定速度提供大量食物，这是较低密集农业无法提供的，因此我们必须至少保留一些工厂化技术。,我们应该禁止工厂养殖
消费者不知道天然疗法中真正含有什么，因为没有监管。,我们应该禁止自然疗法
一位遭受严重疤痕的孩子可能需要进行整形手术。,我们应该禁止未成年人进行整容手术
一个国家有权发展任何武器，以帮助其抵御敌人。,我们应该为废除核武器而奋斗
一个国家应有权利以任何其认为合适的方式来自卫，即使他们没有打算使用核武器。,我们应该为废除核武器而奋斗
一个人口多元化的国家最好由一个多党制来代表。,我们应该采取多党制。
一个国家在自由主义下会崩溃，因为没有对人民进行有效监督。,我们应该采纳自由主义。
一对夫妇并不需要通过结婚这种法律方式来证明彼此之间的爱。,我们应该放弃婚姻
一个犯罪分子如果犯下两次罪行，很可能会继续犯罪，所以三次罪行法会让他们更早地远离公众，这对大家都有好处。,我们应该废除三罢法。
一个罪犯在考虑到下一次犯罪可能意味着终身监禁时，可能会三思而后行。,我们应该废除三罢法。
在结束了某人的生命之后不久，可能会发现一种治愈或治疗方法。,协助自杀应视为犯罪行为.
被告有权为自己辩护,公共辩护律师的使用应该是强制性的
据说，一个民主自由的社会应该尊重身体自主权，因此我们应该有权利自由处理我们的器官，包括在合法的器官交易中使用它们,我们应该合法化器官交易
自然疗法的一个缺点是，当服用自然药物治疗疾病时，没有寻求合格医疗帮助。,我们应该禁止自然疗法
一个在孩子生活中扮演积极角色的父亲形象对孩子有积极影响,我们应该给予居家爸爸补贴。
一个父亲有权牺牲自己的工作时间陪伴新生儿，但这是一种生活方式选择，应该自行负担，而不是由纳税人财政支持。,我们应该补贴家庭主夫。
一些嘴硬的人不应该能改变多年来的法律,我们应该限制司法激进行为
一面旗帜只是一个象征，本身并没有实际含义。因此，烧毁它并不是什么大事。,我们应该禁止焚烧国旗
一面旗帜被大规模制造，并且除了它所用的材料之外，并没有增加的商业价值。,我们应该禁止烧国旗
一面旗帜仅仅是一个象征，如果禁止烧旗帜，那你也得禁止烧足球衬衫等物品。,我们应该禁止烧国旗
一面旗帜只是一块布，没有禁止燃烧布这一说法。,我们应该禁止烧国旗
一面旗帜只是一个象征，允许烧毁它作为愤怒的表达就是言论自由。,我们应该禁止烧国旗。
一面旗帜只是一块布料，实际上并不会伤害任何人。,我们应该禁止焚烧国旗
一面旗帜象征着一个国家，烧毁它意味着不尊重。,我们应该禁止烧国旗
一份正式的学校祈祷无法被正确地视为宗教自由行使，禁止学校祈祷完全与宗教自由行使相容。,我们应该禁止学校祈祷
应采用性别中立的语言，以使对话和语言对所有人都公平。,我们应该采用性别中立的语言
一个性别中性的语言会提高性别平等,我们应该采用性别中立的语言
我们都应该学习使用性别中性的语言，这将有助于应对种族主义和其他社会问题。,我们应该采用性别中立的语言
一个性别中立的语言需要数百年的时间才能被采用，因此应该放弃。,我们应该采用性别中立的语言
一个有天赋的标签可能会导致孩子不努力工作，像他们应该的那样。,智力测试带来更多伤害而不是益处
如今很大一部分电话推销人员甚至不是人类，这是非法的并且不道德。,我们应该禁止电话营销。
政府禁止发放发薪日贷款是保护最脆弱群体的唯一途径。,应禁止发放薪水贷款
政府应该尽其所能保护自己的安全。,我们应该禁止有针对性的杀戮。
一家由政府资助的维基百科将变成一家由政府控制的维基百科。,我们应该对维基百科进行补贴。
每年都有大量的资金被浪费在试图监管大麻的使用上，如果大麻合法化了，这些资金就能节省下来。,我们应该合法化大麻
一个团队一起合作相比单独工作时能更有效地发挥作用并产生更大的影响。,我们应该反对集体主义
一群统一立场的集体思想更加强大。,我们应该反对集体主义。
如果他们愿意，一个团体应该能够被识别并作为一种宗教实行。,我们应该禁止科学教会。
高投票率对于获得合法民主授权和民主体系的运作十分重要。,我们应该引入强制投票制度
一个临终的人可以帮助其他人活下去，通过器官移植帮助他们的家人延续生命。,我们应该合法化器官交易
一位人权活动家发表讲话称，人们不应因为属于某个群体或有不同肤色而遭受种族歧视。,我们应该终止种族歧视
一名法官允许个人感情参与判决会导致该判决不公正。,我们应该限制司法激进主义
一个法官是一个可信赖的被选举产生的个人，他的决定应当受到信任。,我们应该限制司法激进主义
法官仅仅应该解释法律问题是否符合宪法 -- 司法激进主义实质上是在法庭上立法，这超出了司法部门被允许做的事情。,我们应该限制司法活动主义
法官不是上帝，因此不应该做出所有决定。,我们应该限制司法激进主义
一名法官应受到高度尊重，并且应该遵守他们宣誓要维护的法律，不偏不倚。,我们应该限制司法激进主义
一名法官应该维护法治，而不是用自己的观点/意见/信仰来改变它。,我们应当限制司法激进主义
一名法官应被允许部分地使用自己的信念来判断一个论点的合宪性。,我们应该限制司法激进主义
一位法官不应该展示他们的个人观点。,我们应该限制司法激进主义。
一名法官的看法不应在其作为法官做出决定时起作用,我们应该限制司法激进主义
一位法官的观点不应该凌驾于官方法律之上。,我们应该限制司法激进主义。
一名法官的角色不是炫耀法律并擅自覆盖指导，而是要执行法律。司法激进主义走得太远。,我们应该限制司法激进主义
一名法官应该被允许审视犯罪和犯罪行为所涉及的情况，因为惩罚应该根据个人情况来确定。,我们应该限制司法激进主义。
法官应该被允许根据特定情况和环境做出决策，并根据呈现的信息和问题来做出判断，而不是严格遵循一般化的标准。,我们应当限制司法激进主义。
一位法官应该遵循法律而不是个人意见，因为他们被视为最高权力来审判他们尊重、维护的法律。,我们应该限制司法激进行为
多党制的一个关键优势是选民可以选择他们想要选举的政党。,我们应该采取多党制。
由于外貌缺乏自信心可能会给人们的生活造成毁灭性的影响，而整形手术可以帮助减少这种影响。,我们应该禁止整形手术
缺乏控制意味着如果出了问题就没有人能介入,我们应该停止自动驾驶汽车的发展
选票的缺乏导致了议会没有公正的代表情况。,我们应该引入强制选举。
不包括性别的语言剥夺了人们的个性。,我们应该采用性别中性语言
世界上绝大多数人以某种形式信仰上帝，因此选择无神论并不符合大多数人的信仰。,我们应该接受无神论
通常情况下，更大的人群能够通过人数优势提供更多的价值。拥有更多的想法和更多的人力，大团体通常有更多的价值。,我们应该反对集体主义。
律师为他的客户提供更好的代表比一个得到较少报酬的公共辩护律师。,公共辩护律师的使用应当是强制性的
合法的器官交易将增加移植器官的供应量，并拯救生命。,我们应该合法化器官交易。
合法化器官交易将显著提高移植器官的存货量，拯救生命。,我们应该合法化器官交易。
合法化器官买卖将增加用于医疗程序的库存量，并使该程序变得更安全更受监管。,我们应该合法化器官交易
合法化的交易会对那些来自较贫困经济背景的人造成不成比例的伤害，还会合法化涉及的巨大健康风险。,我们应该合法化器官交易
一个合法化的市场会剥削贫困人口，由于财务问题，他们很可能会成为出售器官的最有可能的人选。,我们应该合法化器官交易
一个自由主义政府只是借口从富人那里拿走，然后给穷人。,我们应该采纳自由主义。
一个自由主义政府将为底层阶级提供急需的资源。,我们应该采纳自由主义。 
一个自由主义系统允许并确保一个人可以自由做任何他们想做的事情，只要这些行为不会妨碍或侵犯其他人的权利。,我们应该采纳自由主义。
不伤害他人的生活方式应该是合法的,我们应该合法化一夫多妻。
如果我们放弃电视，就会有更多的工作和研究可以完成。,我们应该放弃电视
许多性别中性语言假定男性版本的词作为新被接受的中性词。这并不使其中性化，只是假定男性更好。,我们应该采用性别中立的语言
许多自然医学专家在缺乏科学支持的情况下提出建议，可能会损害患者。,我们应该禁止自然疗法
军事行动需要大量私人资源，比如武器制造。使用私人军事公司并无不同。,我们应该禁止私人军事公司。
很多罪犯都属于特定的种族，所以为了安全目的和挽救生命，警察应该被允许进行种族歧视，作为付出一点痛苦的交换。 ,我们应该终止种族歧视检查
许多时候，整形手术的身体和情感后遗症会击败整形手术的主要目的。,我们应该禁止整形手术
很多时候，进行家庭教育的人并没有达到高中文凭所需的所有科目的教学资格。,家庭教育应该被禁止
他们所做的很多事情都很危险，包括反对疫苗。,我们应该禁止自然疗法
很多卖淫的女性本身也曾受到性侵，因此提供更好的选择可能更为合适。,我们应该合法化卖淫。
低分数可能会阻止个人达到其最大潜力，并且如果将测试结果视为衡量个人价值的标准，可能会带来分裂。,智力测试带来的伤害大于好处
低投票率意味着当选政府不代表国家真实意愿。强制投票将意味着当选政府获得真正的授权。,我们应该引入强制投票。
大多数美国人信仰宗教。,我们应该选择无神论。
大多数学生无法支付高昂的大学学费,我们应该对学生贷款进行补贴
一个男人或女人有权利做他们希望做的事情，如果他们选择出售自己的身体用于性服务，政府不应干涉。,我们应该合法化卖淫。
强制性的退休年龄允许雇主为他们的工作队伍引入新鲜的人才。,我们应该取消强制退休。
强制性退休年龄确保某些职位会定期空出，使年轻员工得以进入当老员工离开时。,我们应该取消强制退休。
强制退休年龄有助于雇主定期注入新鲜人才，更新劳动力队伍。,我们应该结束强制退休。
一个男人的地方就是在职场为家庭提供。为什么其他人要为这个家庭买单，只是因为这个人不愿意去工作呢？,我们应该对待在家的父亲进行补贴。
婚姻只是一张纸，不过如此。,我们应该放弃婚姻
学校对零容忍的度量会使制度崩溃，因为每种情况都需要一定的灵活性。,我们应该在学校内实行零容忍政策。
一位医生表示，80%参加智力测试的学生在面对测试结果的不确定性困扰时，会出现学习能力的极强下降。,智力测试带来的伤害多于好处
军事公司禁令只会关闭机会。,我们应该禁止私人军事公司
导致微型军备竞赛的导弹防御开发者和导弹开发者之间的对抗会给任何拥有这两个产业的国家造成巨额开支。,我们应该为废除核武器而斗争。
未成年人没有必要的心理和情感发展来做出具有长期影响的决定。,我们应该禁止未成年人进行整形手术
未成年人绝对没有足够的责任来决定进行整形手术。你会看到太多孩子这样做，因为他们想要像流行偶像一样。这是危险的。,我们应该禁止未成年人进行整容手术
未成年人还没有足够的年龄来做决定，特别是关乎会永久改变他们的事情。,我们应该禁止未成年人进行整容手术
未成年人仍在成长，因此任何整容手术在他们完全长成之前可能会导致不太理想的结果。,我们应该禁止未成年人进行整容手术
如果整形手术可以改善未成年人对自身的看法并提高他们的信心，那么他们应该被允许接受这种手术。这些改变会以积极的方式影响他们的成年生活。,我们应该禁止未成年人进行整形手术。
未成年人应对自己的身体拥有控制权,我们应该禁止未成年人进行整形手术
一个错误可能导致一个人永久毁容,我们应该禁止整容手术
一个主张性别平等的现代社会有责任补贴留在家中照顾孩子的父亲，就像它对待母亲一样支持——这既改善了女性的职业前景，也增进了父亲与孩子的情感联系。,我们应该对居家父亲提供补贴。
一个多党制是必要的，因为除了民主党和共和党之外还有更多观点。,我们应该采取多党制。
多党制允许多样化人口有更好的选择，意味着他们可以找到一个他们真正信任并投票支持的人，更好地参与民主。,我们应该采用多党制。
多党制允许更多合格个人参与。,我们应该采取多党制制度。
多党制会给人们提供太多选择从而制造混乱。,我们应该采取多党制。
多党制并不总是有利的。要知道，我们可能会面临多个糟糕的选择，最终只能选择两害相权取其轻。,我们应该采用多党制。
多党制确保每个人的观点都能被代表和纳入考虑，而不仅仅是少数人。,我们应该采取多党制。
一个多党制体系有助于确保所有人都得到代表，而没有任何一个政党或派别变得过于强大。多党制体系在各个层面上更加公平，不会全盘偏袒某一群体。,我们应该采取多党制。
一个多党制系统过于不稳定，缺乏稳定性和一致性。,我们应该采取多党制。
一个多党制可能会太过混乱，因为会有太多候选人持有太多不同的观点，选举将会变得十分困难。,我们应该采取多党制。
一个多党制将有助于我们选择最适合这项工作的人。,我们应采取多党制。
多党制将导致边缘团体的崛起，这些团体并不代表人民的意愿。,我们应该采用多党制。
多党制将为政治舞台带来许多新鲜和新颖的想法。,我们应该采取多党制。
多党制将确保更多人的观点被考虑在内。,我们应该采纳多党制。
多党制会代表所有投票的人，而不仅仅是投票给一个政党的人，因此一个更公平的治理体系会得以建立。,我们应该采取多党制。
一个多党制系统会花费更多的时间在争论而不是解决问题上，并且并不会有益。,我们应该采纳多党制
多党制与宪法不一致。,我们应该采取多党制。
一个多元化系统为更多选项和候选人提供了可能，因为并非每个人的政治观点都相同。,我们应该采纳多党制。
一个多党制系统可以减少特定候选人的票数，导致选票被挪用。,我们应该采取多党制。
多党制确保所有人和声音被听到和代表。,我们应该采用多党制。
多党制对于实现民主、防止专制政权上台至关重要。,我们应该采用多党制。
多党制允许选民更大的选择自由，表达他们对实施的政策投票的民主权利。,我们应该采取多党制。
多党制可以使更多的观点被听到。,我们应该采纳多党制。
多党制允许多个政党进入政府，是民主的标志。,我们应该采取多党制。
一个多党制系统允许所有政党代表所有人。,我们应该采取多党制。
多党制允许广泛范围的观点得以被听取和实施。,我们应该采用多党制。
多党制能够提供个体更广泛的选项，让他们能够找到真正代表他们的正确政党。,我们应该采纳多党制。
多党制允许不同思想的存在，为人民提供更多选择。,我们应该采用多党制
多党制允许人们在投票时有更多的选择。它让每个公民都能投给最符合自己信仰并代表其意识形态的政党。,我们应该采取多党制。
多党制能够提供更大的选择自由和言论表达自由,我们应该采取多党制。
多党制能够提供更大的选择自由，因为更多的主要政党将涵盖更多意识形态观点。,我们应该采用多党制。
多党制允许选民更多的言论自由，并减少对自己最不赞同的候选人投票的需求,我们应该采用多党制。
多党制提供了更多选择，以解决不同观点和问题，使多个候选人提供。,我们应该采取多党制。
多党制允许更多的想法、更多的候选人、更多的选民投票。,我们应该采用多党制。
多党制可以让更多不合格的人参与竞选。,我们应该采纳多党制。
多党制允许更多的观点和理念得到代表。,我们应该采取多党制。
多党制允许更多观点的表达，需要政治家建立联盟并妥协以完成事务。,我们应该采取多党制。
多党制允许人民在不同的思想集合中进行选择，从而决定谁来治理国家。,我们应该采取多党制。
多党制允许对执政政府进行公开和建设性的批评，防止了专制统治。,我们应该采取多党制。
这样的多党制将确保所有政策都经过达成一致，而不是由少数人强行通过。它还将确保更广泛的信仰和观点得到代表。,我们应该采纳多党制。
多党制模糊了国家愿景和模型的公民性。我们不应该采纳多党制，因为这会浪费宝贵的时间来达成一致。,我们应该采取多党制制度。
多党制给政治领域带来了多样性，有助于人们更好地决定他们的选票应该投给谁。,我们应该采用多党制。
一个多党制系统会给本应简单到“遵纪守法”的政府体系带来持续的争吵和无休止的内斗。,我们应该采纳多党制。
多党制可以增加人民的意见并提供更多选择。,我们应该采取多党制制度
一个多党制可以打开把不称职的领导摒除出去并创造变革的大门。,我们应该采取多党制。
多党制可以导致某人当选，而其受到少数公民的支持。,我们应该采取多党制。
一个多党制系统可能增加更多复杂性，并导致问题变得无法解决的情况。,我们应该采取多党制。
一个多党制系统可能非常有益，因为它将允许更多不同的观点和选择。,我们应该采用多党制。
一个多党制可能导致本该合作的团体之间的内讧过多。,我们应该采取多党制
多党制可能会增加政治官僚主义,我们应该采取多党制。
多党制可能会导致更多情况下无法达成多数意见。这意味着推动政策通过可能会更加困难。,我们应该采取多党制。
多党制可能会让决策变得更加困难，因为更多意见会使事情变得更加复杂。,我们应该采取多党制。
多党制可能意味着很难就任何问题达成一致意见，因为可能在问题上没有多数派。,我们应该采用多党制。
一个多党制会造成混乱。 在这种情况下，多并不一定更好。,我们应该采取多党制。
