争论,主题
我们都是社会的一部分，必须支持我们的国家和选举产生的政府。如果政府陷入债务或赤字，我们有义务帮助并支持它。,我们应该实行紧缩政策。
随着我们成功应对了ISIS威胁，我们应该关闭关塔那摩湾拘留营。,我们应该关闭关塔那摩湾拘留营。
除了宗教教育外，传教士还在第三世界国家从事有价值的发展工作，因此不应该被禁止。,我们应该禁止宣教工作
除了显而易见的有害财务影响外，研究还表明，这些高利贷还对贷款接受者的心理健康和幸福感造成了极其不利的影响。,应该禁止发放薪水贷款
辅助自杀可能会被那些想要从患病或生病的亲戚身上谋求利益的人滥用，因此不应被允许。,协助自杀应视为犯罪行为。
暗杀是国家国防和间谍活动中不可或缺的工具，它可以使国家避免武装冲突。,我们应该禁止有针对性的暗杀。
当《权利法案》写成的时候，并没有类似突击步枪、机关枪等这些武器存在。如今的武器只是用来对付其他人的。,我们应该废除持有和携带武器的权利。
协助自杀基本上就是谋杀。,协助自杀应该是一种犯罪行为
安乐死使一个人能够以尊严的方式离世，而不必经历痛苦和丧失人性的过程。,协助自杀应该是一种犯罪行为。
协助自杀允许一个生病的人，在确切了解情况并不能确保生活质量的情况下结束他们的痛苦,协助自杀应该是一种刑事犯罪。
协助自杀允许人结束终末痛苦和折磨，并应该被允许继续进行。,辅助自杀应该是一种刑事犯罪。
协助自杀使得那些患有严重健康状况的人可以体面地离世。如果协助自杀属于犯罪，他们可能不得不忍受多年的痛苦生活。,协助自杀应该构成刑事犯罪。
协助自杀可以让患绝症的人能够体面地离世，不应被定为犯罪。,协助自杀应当是一种犯罪行为
安乐死使得患绝症的人能够选择何时离世，并能够以尊严的方式实现。它让人们有权选择不在痛苦和煎熬中生活，选择通过人为干预来结束生命。,协助自杀应被视为刑事犯罪
协助自杀和以尊严生活的权利是一项人权，应当在全世界合法化。选择不必承受终末疾病的痛苦是一项人权。,协助自杀应该是一种犯罪行为。
协助自杀与谋杀之间的界限变得模糊——即使患者“同意”。,协助自杀应被视为犯罪行为
协助自杀有时可能是唯一的方法，来结束一些患有无法治愈的严重疾病如运动神经元疾病等的病人难以忍受的痛苦。,协助自杀应该是一种刑事犯罪
协助自杀也可以被称为谋杀，因为这是帮助他人死亡，因此应被视为一种犯罪行为。,协助自杀应该是一种刑事犯罪。
协助自杀可能会被一些希望让他们虚弱的伴侣死去的人滥用。人们可能会被鼓励在他们真正想这么做之前结束自己的生命。,协助自杀应该构成刑事犯罪
帮助自杀可能会被一些希望从无法阻止他们的晚期患者身上获利的人滥用。,协助自杀应视为刑事犯罪
协助自杀赋予人们在糟糕情况下对生命的控制。它让他们在死亡中保持尊严，而不是活在痛苦的条件下多年。,协助自杀应该是一种犯罪行为
医生所发誓要做到不伤害患者，而故意自杀直接违背了这一誓言。自杀是伤害。在给予患者药物时没有监督。这些药物被开出，患者面对死亡时是孤独的。,协助自杀应该是一种刑事犯罪。
辅助自杀极大减轻了病人的痛苦和痛苦并赋予了人们在死亡中的尊严，因此应该合法化。,协助自杀应该是一种犯罪行为
辅助自杀帮助苦难患者以非暴力的方式结束他们的痛苦。,协助自杀应被视为刑事犯罪。
辅助自杀帮助患有绝症的人结束他们的痛苦,协助自杀应该构成犯罪。
安乐死帮助那些因终末期疾病而遭受持续痛苦的人们。,协助自杀应被视为犯罪行为
辅助自杀帮助患有毁灭性疾病并因疼痛而痛苦的人以自己的方式结束自己的生命。,协助自杀应该是一种刑事犯罪。
协助自杀涉及谋杀他人，这是违法的，应该被视为违法行为。,协助自杀行为应被视为刑事犯罪
协助自杀是一种恩赐，而不是犯罪。希望得到协助的人可能正在遭受巨大痛苦，或者已经无法治愈，让某人给予这些受苦者结束痛苦的机会。,协助自杀应该是一种刑事犯罪。
辅助自杀是一种发自仁慈的行为，旨在终止晚期疾病患者的痛苦。法律需要在适当的监管框架和严格保护措施下保护这些人。,协助自杀应该构成犯罪行为
辅助自杀是一种有同情心的方式，可以帮助选择以非暴力方式结束生命的人。,协助自杀应视为犯罪行为
协助自杀是一种犯罪，涉案人员应该被送入监狱。,协助自杀应该是一种犯罪行为。
协助自杀是一种犯罪行为，因为它涉及对人类的故意致死。,协助自杀应视为犯罪行为。
协助自杀是一种刑事犯罪，属于一种协助谋杀的行为。,协助自杀应该构成刑事犯罪。
辅助自杀是一种谋杀行为，应被视为犯罪行为。,“协助自杀应该是一种犯罪行为。”
辅助自杀是一种谋杀行为，应视为犯罪。,协助自杀应该是一种犯罪行为。
协助自杀是一种谋杀行为，绝对不应该被允许。,协助自杀应该是一种刑事犯罪。
辅助自杀是一种有预谋的谋杀行为，应当受到起诉。,协助自杀应视为刑事犯罪
安乐死对于那些患有致命疾病且行将就木的人来说是一个极大的帮助,协助自杀应该是一种刑事犯罪。
协助自杀是一项人权，并且能够减轻晚期患者的痛苦。,协助自杀行为应被视为刑事犯罪
辅助自杀是一种人道和关爱的方式，允许一个人帮助另一个生活过于艰难的人，因此不应该被定为刑事犯罪。,"""协助自杀应该是一种刑事犯罪行为"""
辅助自杀是一种人道的方式来结束生命，就像我们处理感到痛苦的动物一样，并不应该构成刑事犯罪。,协助自杀应视为刑事犯罪
辅助自杀比让一个人苦苦挣扎到生命终结要好得多。,协助他杀应视为刑事犯罪。
辅助自杀是个人选择，关乎一个人想要如何过自己的生活，因此应该根据宪法合法化。,协助自杀应该是一种刑事犯罪。
协助自杀是个人决定，政府不应干涉个人的决定。,"""协助自杀应该是一种犯罪行为。"""
对于那些受苦且没有希望生存下去的人来说，辅助自杀是有利的。,协助自杀应视为刑事犯罪。
辅助自杀再次成为自然生命规律，而且应该是一种犯罪行为。,协助自杀应视为刑事犯罪
辅助自杀违背所有医生所宣誓的誓言。,协助自杀应该是一种刑事犯罪。
辅助自杀是由那些关心终末期疾病患者的人执行的一种怜悯行为，这些患者正经历极度痛苦——帮助别人实现最后愿望仅仅是一种服务形式。,协助自杀应该是一种犯罪行为。
协助自杀是一种行为，即你帮助和支持另一个人结束生命，以终止存在。,辅助自杀应被视为一种犯罪行为
协助自杀是另一种谋杀形式,协助自杀应被视为一种犯罪行为。
辅助自杀是另一种形式的谋杀。,协助自杀应视为刑事犯罪
协助自杀充其量是非法杀人，最坏的情况是谋杀。 必须将其保持为刑事罪行，以保护生命权。,协助自杀应被视为一种犯罪行为
协助自杀应该由患有绝症的个人自行决定，并且应该有权在他们认为合适的时候结束自己的生命。,协助自杀应当构成刑事犯罪。
协助自杀等同于谋杀，应当同等对待。,协助自杀应被视为犯罪行为
协助自杀与谋杀同样严重，一个人的生命结束应由上帝决定，因此应视为犯罪。,协助自杀应该是一种刑事犯罪。
协助自杀实质上是谋杀行为，应当被视为谋杀并受到相应的惩罚。,协助自杀应当构成犯罪。
辅助自杀是没有人性、残忍的。,协助自杀应被视为犯罪行为。
辅助自杀是不道德的且构成犯罪,协助自杀应属犯罪行为。
协助自杀只是另一种形式的谋杀。而谋杀是非法的，因此协助自杀也必须是非法的。,协助自杀应该构成犯罪行为
“辅助自杀”只不过是谋杀的另一种说法。,协助自杀应该构成犯罪。
协助自杀实质上是帮助一个人杀死自己，这看起来应该是一种犯罪行为。,协助自杀应该是一种刑事犯罪。
辅助自杀就像是凶杀的从犯。,协助自杀应该是一种犯罪行为
辅助自杀只是另一种形式的谋杀，应该相应地受到惩罚。,协助自杀应视为刑事犯罪
辅助自杀其实就是另一种说法下的杀人行为——这种做法容易受到那些有利益关系的人的滥用，因为往往无法准确解释受援者的意图。,协助自杀应该是一种刑事犯罪。
协助自杀是指在有人的请求下杀死他们,协助自杀应视为犯罪行为
辅助自杀是谋杀，而谋杀属于刑事犯罪。,协助自杀应当是一种刑事犯罪。
辅助自杀是谋杀行为，应该被禁止。,协助自杀应该是一种犯罪行为
辅助自杀是谋杀，应被视为谋杀行为受到惩罚。,协助自杀应被视为刑事犯罪
辅助自杀是谋杀，因此是非法的,协助自杀应该是一种刑事犯罪。
协助自杀是另一种形式的谋杀，应该继续保持非法。,辅助自杀应该是一种犯罪行为
辅助自杀是对他人的谋杀，并应被视为刑事犯罪。,协助自杀应属刑事罪行
协助自杀就是谋杀，医生是将武器交给那个人，目的就是让其死亡。,协助自杀应该是一种犯罪行为。
在我们这个充满痛苦和悲伤的现代世界中，辅助自杀是必要的。,协助自杀应当构成犯罪。
辅助自杀不仅道德上不允许，而且是一种谋杀行为，应当被视为刑事犯罪。,协助自杀应是一种刑事犯罪。
协助自杀不过是谋杀行为。你正在让一个人有合法的能力去杀死另一个人。这种行为应该被制止。没有人应该被允许导致他人死亡。,协助自杀应被视为刑事犯罪。
协助自杀简直就是谋杀，应视为犯罪行为。,协助自杀应该是一种刑事犯罪。
辅助自杀实际上只是对谋杀或杀人的另一种说法。,协助他人自杀应该构成犯罪。
有时安乐死是一些人唯一的解决方案，我们不应排除这个选项。,协助自杀应视为一种刑事犯罪
辅助自杀本质上是一个人杀害另一个人,协助自杀应该构成犯罪。
辅助自杀依然是自杀，无论以何种形式，都是不道德的。,协助自杀应被视为刑事犯罪
辅助自杀仍然是自杀，这是道德上不可接受的。,协助自杀应被视为刑事犯罪。
辅助自杀依然是一种自杀行为，无论以何种形式都是错误的。,协助自杀应该是一种犯罪行为
协助自杀仍然是夺取他人生命，不管它如何被包装 - 这不能是灰色地带，杀人是错误的，法律需要就此采取立场，以避免滑坡。,协助自杀应该是一种犯罪行为
协助自杀是帮助晚期患者避免生命最后几个小时或几天成为折磨的最仁慈的方式，因此不应被定为刑事犯罪。,协助自杀应该是一种刑事犯罪。
协助自杀是对于那些患有晚期疾病或没有生活质量的人们解除难忍痛苦的行为-这是一种无私的善举，应该在法律上得到保护。,协助自杀应该构成刑事犯罪。
协助自杀等同于谋杀，因此应该被视为非法。,协助自杀应该是一种犯罪行为
协助自杀太危险了，因为如果有人身体虚弱，一个有控制欲的人可能会在他们并不真正想要这样做的时候鼓励他们自杀。,协助自杀应该成为一项刑事犯罪。
协助自杀太过风险，因为有可能有人心智不清，无法准确决定是否真的想要死亡。如果出现错误，那么就可能会演变成谋杀。,协助自杀应该是一种刑事犯罪
协助自杀是不道德的，我们如何知道协助自杀的人不会从另一个人的死亡中得到好处。,协助自杀应被视为犯罪行为
辅助自杀是错误的，我们应该努力帮助这个人康复，而不是让他们自杀。,协助自杀应当是一种犯罪行为。
辅助自杀是错误的，没有人应该夺走别人的生命，未来总会有希望。,协助自杀应当被视为犯罪行为
辅助自杀可能是对那些病情晚期、无需承受不必要的痛苦的患者的一个不错的选择。,协助自杀应被视为犯罪行为
"""应该允许辅助自杀。如果一个晚期病患想结束自己的生命，应该让他们在专业人士的帮助下获得宁静，而不是可能让情况变得更糟糕。""",协助自杀应被视为犯罪行为。
在人们患病并经过彻底评估确认属实的情况下，辅助自杀必须存在，否则必须受到惩罚。,协助自杀应该是一种犯罪行为
协助自杀只会给亡者的家人带来问题,协助自杀应该是一种刑事犯罪
那些无法自行结束生命的人应该有选择辅助自杀的权利,协助自杀应被视为刑事犯罪。
协助自杀应该是一种犯罪行为，因为无论在什么情况下杀害他人都是不对的。,协助自杀应被视为刑事犯罪
协助自杀为疼痛中的人提供了结束生命、停止痛苦的方式。他们应该被允许以尊严的方式死去，并选择对他们来说何时是正确的时机。,协助自杀应该是一种犯罪行为。
协助自杀不应该被视为刑事犯罪，因为患有慢性健康问题的人可能无法独自自杀，但他们应该有权选择是否继续受苦。,协助自杀应视为刑事犯罪。
协助自杀应该是一种犯罪行为，以防止贪婪的个人杀害家人以获取其财产和金钱。,协助自杀应该是一个刑事犯罪。
协助自杀应视为刑事犯罪，因为如果一个人不能做出自己的决定和行动，那么就不可能知道帮助他们的人是在帮助还是谋杀他们。,协助自杀应当是一种刑事犯罪。
协助自杀应该是一种犯罪行为，因为它是另一种形式的谋杀。,协助自杀应当被视为犯罪行为
协助自杀应该被视为犯罪行为，因为实质上是在帮助他人杀人，应适用过失杀人法规。,协助自杀应被视为刑事犯罪
协助自杀应该是一种犯罪行为，因为它只是另一种谋杀的形式。,协助自杀应该是一种犯罪行为
协助自杀应该视为一种犯罪行为，因为扮演上帝并非人类的权利，而且可能会导致谋杀行为，而非协助自杀。,协助自杀应该是一种刑事犯罪。
协助自杀应该被视为刑事犯罪，因为当死者去世后，没有人会真正知道到底发生了什么，无论是协助自杀还是谋杀。,协助自杀应该是一种犯罪行为
协助自杀应当被视为刑事犯罪，因为违背上帝的法律。,协助自杀应该是一种犯罪行为
协助自杀应该被视为一种犯罪行为，因为这是违背人的生命的。,协助自杀应该被视为一种犯罪行为。
帮助自杀应该被视为犯罪行为，因为它导致了一个人的死亡，就像被罪犯杀害一样。,协助自杀应该被视为一种犯罪行为
辅助自杀应该是一种犯罪行为，因为它可能涉及谋杀情形。这如何能被证实？,协助自杀应被视为犯罪行为
辅助自杀应当是一种刑事犯罪，因为这可能会迫使一些医生在未经他们同意的情况下执行这一行为。,协助自杀应被视为犯罪行为
协助自杀应该是一种犯罪行为，因为它不允许一个人自然死亡。,辅助自杀应该是一种犯罪行为
辅助自杀应该构成犯罪，因为这在道德上是错误的。,协助自杀应该是一种犯罪行为
协助自杀应被视为刑事犯罪，因为即使该行为是被选择的，仍然被视为谋杀。,协助自杀应该是一种刑事犯罪。
协助自杀应视为刑事犯罪，因为这是对一个活着的人的杀害，就像用毒药或枪支杀人一样。,协助自杀应被视为一种犯罪行为
协助自杀应该是一种犯罪行为，因为很容易谋杀一个容易受到伤害的亲戚以获取遗产。,协助自杀应该是一种刑事犯罪
协助自杀应被视为刑事犯罪，因为无论是否自愿，杀人都是错误的。,协助自杀应当是一种犯罪行为
协助自杀应被视为犯罪行为，因为杀害他人是错误的，即使他们希望你这样做。,协助自杀应被视为一种犯罪行为
协助自杀应该是一种犯罪行为，因为没有人有权利夺去他人的生命或帮助他们。,协助自杀应该构成犯罪。
协助自杀应该是一种刑事犯罪，因为疼痛会让人做出一些极端的事情，但这不应包括死亡。,协助自杀应该被视为犯罪行为。
协助自杀应该是一种犯罪行为，因为人们不应该能够帮助他人谋杀。,协助自杀应该是一种刑事犯罪。
协助自杀应该是一种刑事犯罪，因为那是谋杀。,"""协助自杀应该是一种犯罪行为"""
协助自杀应该视为刑事犯罪，因为这个人基本上是在杀害另一个人。,"""协助自杀应该是一种犯罪行为"""
协助自杀应该是一种犯罪行为，因为我们不能仅仅因为一个人有问题就让其去世。,协助自杀应该是一种犯罪行为。
协助自杀应该是一种犯罪行为，因为如果被协助的人只是处于糟糕的情绪状态，而这种状态可能通过专业的心理健康治疗来治愈。,协助自杀应视为刑事犯罪。
协助自杀对于安乐死应该构成刑事犯罪。,协助自杀应被视为刑事犯罪
"""协助自杀应该是上帝法律中的一项犯罪行为。上帝决定你的生命。""",协助自杀应该是一种犯罪行为
协助自杀应该是一个犯罪行为，因为任何形式的自杀（无论是否协助）都是不道德的。,协助自杀应被视为一种犯罪行为
协助自杀应该是一种刑事犯罪，因为归根结底有人丧生，而你参与其中。,协助自杀应该构成犯罪。
协助他人自杀应该是一种犯罪行为，因为无论如何死亡都是死亡，最终某人会死去而你参与其中。,协助自杀应当被视为犯罪行为。
协助自杀应该被视为刑事犯罪，因为这只是谋杀的另一个说法。,协助自杀应该是一种刑事犯罪。
协助自杀应被视为刑事犯罪，因为没有人应该以自杀结束生命。,协助自杀应当是一种刑事犯罪。
协助自杀应被视为谋杀或预谋杀。人们应当自然死亡，而非自杀。,协助自杀应当构成刑事犯罪。
应该允许辅助自杀，因为这样可以让患有绝症的人在遭受漫长而痛苦的死亡之前体面地离世。,协助自杀应被视为犯罪行为
应该允许对患有绝症且痛苦不堪的人实行辅助自杀。,协助自杀应成为刑事犯罪。
如果一个人无法忍受传统医疗治疗的痛苦，应允许协助自杀。这应该是一个人的死亡权利。,协助自杀应被视为犯罪行为。
在某些情况下，比如当一个人患有严重疾病时，辅助自杀应该是被允许的。,协助自杀应该是一种犯罪行为。
应该允许辅助自杀，以避免人们长时间忍受痛苦。,协助自杀应当是一种刑事犯罪。
辅助自杀应该是个体的选择和个人自由。,协助自杀应该是一项刑事犯罪。
协助自杀应该被定为非法，因为没有任何人有权决定另一个人生死。,协助自杀应该是一种犯罪行为。
协助自杀应该是非法的，因为帮助结束生命在道德上从来都不是正确的行为。,协助自杀应该是一种刑事犯罪。
辅助自杀应该在任何地方都是合法的，因为在有一个简单的方法可以结束痛苦时，延长痛苦是不对的。,协助自杀应视为刑事犯罪。
协助自杀应该被合法化，许多人患有令人严重痛苦和虚弱的疾病，他们应该得到咨询和支持，以做出知情选择。,协助自杀应被视为犯罪行为
应该将辅助自杀合法化，这样那些患有绝症或无法忍受疼痛的人可以做出知情选择，以尊严地结束自己的生命，被他们所爱的人包围着。,协助自杀应视为刑事犯罪
协助自杀不应被视为犯罪行为，因为一个人可能真的在遭受痛苦，让他们继续受苦是没有人性的。,协助自杀应该是一种犯罪行为
协助自杀不应被视为犯罪，因为执行者只是在遵循他人的意愿。,协助自杀应该构成刑事犯罪
协助自杀不应该被视为犯罪。如果有人每天因为即将导致他们死亡的病痛而受苦，他们应该被允许按照自己的意愿选择死亡。,协助自杀应视为刑事犯罪。
协助自杀不应作为一种刑事辩护，因为在某些情况下，比如那些患有晚期癌症的人，这么做是给予他们怜悯，让他们免于痛苦。,协助自杀应该是一种犯罪行为
协助自杀不应被视为刑事犯罪，因为人们不应该被期望活在植物人状态下，他们需要帮助来实现自己决定死亡的权利。,辅助自杀应被视为犯罪行为
协助自杀不应该是一种刑事犯罪，因为生活质量欠佳的人不应该被迫无限期地受苦，而他们值得信赖的帮助者也不应该因帮助他们而成为罪犯。,协助自杀应该是一种刑事犯罪。
协助自杀不应被视为违法行为，因为一个人应该能够决定自己想要何时何地去世。,协助自杀应该是一种犯罪行为
协助自杀不应视作刑事犯罪，因为如果有人不愿意活下去，就不应该被强迫。,协助自杀应视为犯罪行为
协助自杀不应被视为刑事犯罪，因为它有助于缓解那些永远无法从疾病或伤害中康复的人的痛苦。,协助自杀应当构成刑事犯罪
协助自杀不应被视为犯罪行为，因为对于一些患有像运动神经元疾病这样令人痛苦的医学状况的人来说，这有时是唯一可以结束生命的方式。,协助自杀应被视为刑事犯罪。
协助自杀不应被视为刑事犯罪，因为此行为属于自杀。,协助自杀应该是一种犯罪行为
如果患者请求进行安乐死，安乐死不应该是一种犯罪行为。,协助自杀应被视为刑事犯罪
协助自杀不应该构成犯罪，因为如果一个亲人患有晚期疾病，这为他们提供了以尊严地死亡的机会，而不是一直痛苦地等待自然死亡。,协助自杀应被视为刑事犯罪
协助自杀不应被视为犯罪行为，因为每个人都应有权在无法得到改善的情况下平静地结束自己的生命。,协助自杀应视为刑事犯罪
协助自杀不应被视为一种犯罪行为，因为如果一个人不想活了，他们为什么要被强迫呢？,辅助自杀应该是一种犯罪行为
协助自杀不应被视为犯罪行为，因为如果有人正在承受足够的痛苦，并且心智清晰地做出决定，他们应该有这个选择。,协助自杀应该是一种刑事犯罪。
协助自杀不应被视为犯罪，因为它帮助那些因终末疾病而饱受痛苦的人们。,协助自杀应被视为犯罪行为。
协助自杀不应被视为犯罪，因为这有助于处于晚期疾病导致剧痛中的人们。,协助自杀应被视为犯罪行为
协助自杀不应被视为犯罪行为，因为当一个人患上严重疾病时，他们不应该被迫继续忍受痛苦。,协助自杀应视为一种犯罪行为
协助自杀不应该是违法行为，因为当你病得无法自拔、丧失希望时，人们应该能够结束痛苦。,协助自杀应被视为一种犯罪行为
协助自杀不应该是一种犯罪行为，因为这应该是一个人针对自己所希望的个人决定。这可以避免对生活质量已经没有改善的人造成几个月甚至数年的痛苦。,协助自杀应该是一种刑事犯罪。
在患终末期癌症等疾病的情况下，只要患者自愿并可以摆脱痛苦，辅助自杀不应被视为刑事犯罪。,协助自杀应当构成犯罪行为
辅助自杀不应被允许，因为生命是珍贵的。,协助自杀应该构成犯罪。
协助自杀不应该作为一个选项，仅仅因为人们正在经历痛苦，因为还有其他帮助缓解疼痛的选择。,协助自杀应该是一种犯罪行为
协助自杀不应该构成犯罪，因为当一个人病得太严重时，医生会实施这项行为。,协助自杀应被视为刑事犯罪。
辅助自杀不应视为刑事犯罪，因为医生会将其作为极度生病的人的选择，以减轻他们的痛苦。,协助自杀应被视为刑事犯罪
协助自杀不应该是一种刑事犯罪，因为每个人都应该有权利决定如果他们不想继续活下去，他们可以得到他人的协助。,协助自杀应被视为刑事犯罪。
协助自杀不应该是一种犯罪行为，因为它允许患者对自己的最终决定拥有控制。,协助自杀应被视为犯罪行为
协助自杀不应该是刑事犯罪，因为它被作为非常病重的人结束他们的痛苦的最后手段。,协助自杀应该是一种刑事犯罪。
辅助自杀不应被视为刑事犯罪，因为有时候人们承受着巨大的痛苦，或者生活无望地躺在床上。,协助自杀应视为刑事犯罪。
如果患有不治之症且必然会死去的人选择辅助自杀，这不应该构成刑事犯罪。,协助自杀应被视为犯罪行为
